[
  {
    "id": 693134,
    "title": "Dune: Part Two",
    "year": 2024,
    "imgs": "https://image.tmdb.org/t/p/w500/1pdfLvkbY9ohJlCjQH2CZjjYVvJ.jpg",
    "type": "movie"
  },
  {
    "id": 872585,
    "title": "Oppenheimer",
    "year": 2023,
    "imgs": "https://image.tmdb.org/t/p/w500/8Gxv8gSFCU0XGDykEGv7zR1n2ua.jpg",
    "type": "movie"
  },
  {
    "id": 94605,
    "title": "Arcane",
    "year": 2021,
    "imgs": "https://image.tmdb.org/t/p/w500/abf8tHznhSvl9BAElD23cZuL0xU.jpg",
    "type": "tv"
  },
  {
    "id": 111110,
    "title": "ONE PIECE",
    "year": 2023,
    "imgs": "https://image.tmdb.org/t/p/w500/rHQRL5nC7Cg12P4N8N2iY427XWz.jpg",
    "type": "tv"
  }
]
