[
  {
    "id": 157336,
    "title": "Interstellar",
    "year": 2014,
    "imgs": "https://image.tmdb.org/t/p/w500/gEU2QlsEOWpNATcbE8Bv2B0p7aM.jpg",
    "type": "movie"
  },
  {
    "id": 1399,
    "title": "Game of Thrones",
    "year": 2011,
    "imgs": "https://image.tmdb.org/t/p/w500/1XS1oqL89opfnbLl8WnZY1O1uJx.jpg",
    "type": "tv"
  }
]
