[
  {
    "id": 60625,
    "title": "Rick and Morty",
    "year": 2013,
    "imgs": "https://image.tmdb.org/t/p/w500/cvhNj9eoRCElWgwCWdOamoIl4IS.jpg",
    "type": "tv"
  },
  {
    "id": 27205,
    "title": "Inception",
    "year": 2010,
    "imgs": "https://image.tmdb.org/t/p/w500/oYuLEt3zVCKq57qu2F8dT7NIa6f.jpg",
    "type": "movie"
  }
]
