[
  {
    "id": 27205,
    "title": "Inception",
    "year": 2010,
    "imgs": "https://image.tmdb.org/t/p/w500/oYuLEt3zVCKq57qu2F8dT7NIa6f.jpg",
    "type": "movie"
  },
  {
    "id": 157336,
    "title": "Interstellar",
    "year": 2014,
    "imgs": "https://image.tmdb.org/t/p/w500/gEU2QlsEOWpNATcbE8Bv2B0p7aM.jpg",
    "type": "movie"
  },
  {
    "id": 155,
    "title": "The Dark Knight",
    "year": 2008,
    "imgs": "https://image.tmdb.org/t/p/w500/qJ2tW6WMUDux911r6m7haRef0WH.jpg",
    "type": "movie"
  },
  {
    "id": 299534,
    "title": "Avengers: Endgame",
    "year": 2019,
    "imgs": "https://image.tmdb.org/t/p/w500/or06FN3Dka5tukK1e9sl16pB3iy.jpg",
    "type": "movie"
  },
  {
    "id": 13,
    "title": "Forrest Gump",
    "year": 1994,
    "imgs": "https://image.tmdb.org/t/p/w500/arw2vcBveWOVZr6pxd9XTd1TdQa.jpg",
    "type": "movie"
  },
  {
    "id": 1399,
    "title": "Game of Thrones",
    "year": 2011,
    "imgs": "https://image.tmdb.org/t/p/w500/1XS1oqL89opfnbLl8WnZY1O1uJx.jpg",
    "type": "tv"
  },
  {
    "id": 1396,
    "title": "Breaking Bad",
    "year": 2008,
    "imgs": "https://image.tmdb.org/t/p/w500/ggFHVNu6YYI5L9pCfOacjizRk1.jpg",
    "type": "tv"
  },
  {
    "id": 66732,
    "title": "Stranger Things",
    "year": 2016,
    "imgs": "https://image.tmdb.org/t/p/w500/49WJfeN0moxb9IPfGn8Slgw3kdZ.jpg",
    "type": "tv"
  },
  {
    "id": 92830,
    "title": "The Last of Us",
    "year": 2023,
    "imgs": "https://image.tmdb.org/t/p/w500/uKvVjHNqB5VmOrdxqAt2F7J78ED.jpg",
    "type": "tv"
  },
  {
    "id": 60625,
    "title": "Rick and Morty",
    "year": 2013,
    "imgs": "https://image.tmdb.org/t/p/w500/cvhNj9eoRCElWgwCWdOamoIl4IS.jpg",
    "type": "tv"
  }
]
